Барбер/мужской парикмахер,Барбершоп Peaky Blinders,110.0,160.0,,,,От 1 года до 3 лет,ТК,45/22,,премии,Идеальное исполнение мужских и детских стрижек опыт камуфляжа и тонирования королевское бритьё и моделирование бороды умение работать опасной бритвой знание основной косметики и средств для укладки консультирование и подбор косметики с последующей продажей,https://hh.ru/vacancy/125289835
Барбер,Саркисян Арарат Левонович,70.0,250.0,,,,Нет опыта,ТК,6/1,,обучение,"✓ стрижки и укладки различной сложности; ✓ моделирование бороды с учетом особенностей силуэта лица; ✓ традиционное бритье; ✓ консультации по выбору стрижки и уходовой косметики. Наш барбершоп расположен в очень перспективном районе с плотной застройкой и большой проходимостью недалеко от станций «Мякинино», «Строгино», «Крылатское». Локация: ЖК Мякинино парк. Также мы готовы рассмотреть талантливых мастеров без опыта работы, обучать и развивать. Если ты ищешь не просто работу, a хороший коллектив и лояльного руководителя, то добро пожаловать!",https://hh.ru/vacancy/125339756
Барбер,Барбершоп ГАРДИАН,90.0,,,,,От 1 года до 3 лет,ТК,"2/2, 5/2",,,Стричь Брить Быть адекватным),https://hh.ru/vacancy/124986138
Барбер,Тимофеева Елена,80.0,,,,,От 3 до 6 лет,ТК,5/2,,"премии, обучение","Выполнение стрижек, бритья и других услуг на высоком уровне. Поддержание чистоты и порядка на рабочем месте. Консультирование клиентов по уходу за волосами и бородой. Постоянное обучение и повышение квалификации. Работа в команде для достижения общих целей.",https://hh.ru/vacancy/124840148
Барбер,Barbershop Britva (ИП Демкин Александр Владимирович),200.0,,,,,От 3 до 6 лет,ТК,"4/3, 5/2, 6/1",,,"Бороды - моделирование и стрижка. Королевское бритьё, бритьё головы, чёрная маска, воск, тонирование. Работа, полная новых впечатлений, встреч и полезных знакомств!",https://hh.ru/vacancy/124633795
Барбер в сеть OldBoy,Барбершоп OldBoy (ИП Дергунова Мария Александровна),90.0,300.0,,,,Нет опыта,ТК,5/2,Ежемесячно,обучение,регулярное обучение сервису и доп. продажам. - оптовый прайс для заказа косметики для себя . - возможность привносить идеи и нововведения. - ,https://hh.ru/vacancy/124232260
Барбер (мужской парикмахер),ТОПГАН,120.0,180.0,,,,От 1 года до 3 лет,ТК,5/2,,премии,Дисциплина.,https://hh.ru/vacancy/124862533
Барбер сети Britva,Касымов Руслан Шавкатович,115.0,175.0,,,,От 1 года до 3 лет,ТК,"6/1, 5/2, 4/3",Еженедельно,,"100+ новых клиентов каждый месяц. 40% с услуг + 50% с акционных предложений (Happy Hours, Студенческие стрижки).",https://hh.ru/vacancy/125360233
Барбер/Парикмахер (м.Теплый Стан/Новоясеневская),Точка,85.0,150.0,,,,От 1 года до 3 лет,ТК,6/1,,"премии, обучение","Женские, мужские, детские стрижки Окрашивания (в один тон, мелирования, сложные окрашивания) Консультирование клиентов по уходовым средствам и процедурам Соблюдение чистоты инструментов и рабочего места",https://hh.ru/vacancy/125383461
Барбер,Бакин Олег Михайлович,120.0,350.0,,,,От 1 года до 3 лет,ТК,"40/50, 10/20, 6/1, 5/2, 4/3",,"премии, бонус, бонусы, обучение","Присоединяйся к ВRITVA с 1 500+ посетителями в месяц и стань частью крепкой команды. • Путь профессионала: стань TOP-, BRAND- или EXPERT-барбером; вырасти до руководителя или пpепoдaватeля в академии • Гарантированный оклад: до 5 000 ₽ (по итогам собеседования) • Доход: 120–350 000 ₽/мес ( 40–50 % с услуг + 10 –20% с продаж) • Удобный график работы: 6/1, 5/2 или 4/3 • Дополнительно: - Премии, бонусы и обучение - Косметика DЕРОΤ, Graham Hill, London Grooming и другие профессиональные бренды - Бонус за привлечение коллег-барберов Готов расти и зарабатывать? Откликайся — обсудим детали!",https://hh.ru/vacancy/124669749
Барбер в барбершоп BETONE,BETONE Barbershop,100.0,350.0,,,,От 1 года до 3 лет,ТК,"40/50, 15/20",Ежемесячно,"премии, бонус, бонусы, обучение",Выполнять мужские стрижки и опасное бритьё на профессиональном уровне. Подбирать и предлагать гостям дополнительные услуги и уходовую косметику. ,https://hh.ru/vacancy/124461063
Парикмахер-универсал / барбер в барбершоп BarbarossA,Горкунов Евгений Иванович,150.0,250.0,,,,От 1 года до 3 лет,ТК,64/27,,"бонус, бонусы",10% с продажи косметики.,https://hh.ru/vacancy/124978707
Барбер в барбершоп BRITVA,Барбершоп BRITVA (ИП Жоров Денис Николаевич),130.0,350.0,,,'10-20,От 1 года до 3 лет,ТК,"10/20, 6/1, 5/2, 4/3",,"премии, бонус, бонусы","Работаем на премиальной косметике: DEPOT, London Grooming, Graham Hill.",https://hh.ru/vacancy/124583646
Барбер,Блохин Даниил Михайлович,80.0,150.0,,,,От 1 года до 3 лет,ТК,6/1,,обучение,"Представление услуг клиентам барбершопа: мужские и детские стрижки, королевское бритье и т.д. Консультация клиентов барбершопа по подбору стиля прически.",https://hh.ru/vacancy/124394820
Мужской Парикмахер/Барбер,Королев Виталий Юрьевич,100.0,130.0,,,,От 1 года до 3 лет,ТК,4/3,,,Мужские и детские стрижки Бритье,https://hh.ru/vacancy/124829190
